,title,marque,image_principale,sku,description,prix,category,images,uniq_id,expiration
41,The Original Donut Shop Regular Keurig K-Cup Coffee Pods - Medium Roast - 24ct,The Original Donut Shop,https://target.scene7.com/is/image/Target/GUEST_e575561f-cbf9-4453-836e-5dff7a955ef5,79582438,"Before coffee was complicated, great coffee was simply fresh, bold, and flavorful. The Original Donut Shop Regular single serve K-Cup pods bring back the classic donut companion, with this ideally balanced brew of the highest quality beans...dunking is encouraged. Full-flavored and easy going, this medium roast blend embodies one of the best things in life - simply great coffee. These single-serve K-Cup pods are compatible with all Keurig K-Cup Pod Single-Serve Coffee Makers and brew up to 12 oz. of The Original Donut Shop Regular coffee each. Each K-Cup pod is filled with the freshest ground coffee and brews a perfect, great tasting cup of coffee, every time. Certified Orthodox Union Kosher and contains no artificial ingredients. Introducing Recyclable* K-Cup Pods: Simple. Delicious. And now Recyclable. Enjoy the same great-tasting coffee you know and love, and when you’re done just peel, empty and recycle. *Check locally, not recycled in all communities. Packaging may vary.",14.99,Beverages,"['https://target.scene7.com/is/image/Target/GUEST_e575561f-cbf9-4453-836e-5dff7a955ef5 ', ' https://target.scene7.com/is/image/Target/GUEST_a88dd428-411d-4fec-9ce8-a0284ae33978 ', ' https://target.scene7.com/is/image/Target/GUEST_ff50e51c-c5a4-42d8-9cbc-5d04f09df779 ', ' https://target.scene7.com/is/image/Target/GUEST_08fb5c4a-bce7-46d5-b099-9bfea05e5d55 ', ' https://target.scene7.com/is/image/Target/GUEST_d9b627b8-4198-4e42-b8d5-5caddd3596cb ', ' https://target.scene7.com/is/image/Target/GUEST_ff50e51c-c5a4-42d8-9cbc-5d04f09df779']",cd1bc348-4a99-5f4b-8122-119ced4a2d17,2022-06-12
42,Tapatio Pollo Asado Marinade - 8oz,Tapatio,https://target.scene7.com/is/image/Target/GUEST_65556dfc-1f36-42e1-b209-b2083e1ad79e,82319200,"Preparing authentic Mexican favorite Pollo Asado has never been easier.  TAPATIO's convenient ready-to-use 8oz pouch provides enough marinade for about 2 pounds of chicken.  Use citrus flavored Pollo Asado marinade, made with authentic TAPATIO salsa picante as the star ingredient, for the most flavorful, mouth watering  chicken.  Make every day a fiesta.",2.59,Pantry,"['https://target.scene7.com/is/image/Target/GUEST_65556dfc-1f36-42e1-b209-b2083e1ad79e ', ' https://target.scene7.com/is/image/Target/GUEST_52143dff-5a3e-4a62-80ec-f72483dab4ff ', ' https://target.scene7.com/is/image/Target/GUEST_1e97b0c3-83a0-47eb-b2f7-cd49fb5a56ec ', ' https://target.scene7.com/is/image/Target/GUEST_146f5cc6-6569-49d8-9a76-df572484438e']",d7a2d44b-31a1-5e11-9ccf-c6a97b1c91d4,2022-06-12
43,La Banderita Carb Counter Keto Friendly White Tortilla Wraps - 11.9oz/8ct,La Banderita,https://target.scene7.com/is/image/Target/GUEST_603e2b66-4dca-4ab7-bdc6-63841ffe821d,79628828,"La Banderita Carb Counter Tortillas are a great choice for a healthier lifestyle. You get only 4g of net carbs, 5g of protein, and 11g of fiber per serving, with only 45 calories! And they are perfect for a Keto Diet! Our delicious Low Carb Tortillas have no added sugars and they are cholesterol free.<br /><br />Taste the tradition!<br /><br />Kosher Parve ═ Certified",3.59,Bakery & Bread,"['https://target.scene7.com/is/image/Target/GUEST_603e2b66-4dca-4ab7-bdc6-63841ffe821d ', ' https://target.scene7.com/is/image/Target/GUEST_29a64d81-f4ff-4258-9a55-07de383f7380 ', ' https://target.scene7.com/is/image/Target/GUEST_38b99ed7-b320-4f2d-97a8-c6a987796bf2 ', ' https://target.scene7.com/is/image/Target/GUEST_d4a12910-0393-4f4b-b7ad-6748e3b9b482']",e9943d88-72ab-5e86-a2bf-8d5970752f58,2022-06-12
46,Espolòn Tequila Blanco - 750ml Bottle,Espolon,https://target.scene7.com/is/image/Target/GUEST_8b32cb3b-8b14-4f39-8715-72231c9b8e7f,50662827,"Inspired by and a tribute to Mexican culture, Espolòn tequila is named for the spur of the iconic rooster, a historic symbol of strength nobility and national pride. Espolon was established in 1998 as a tequila for the people.  Unaged, Espolon Blanco is the purest expression of Espolòn tequila.",24.99,"Wine, Beer & Liquor","['https://target.scene7.com/is/image/Target/GUEST_8b32cb3b-8b14-4f39-8715-72231c9b8e7f ', ' https://target.scene7.com/is/image/Target/GUEST_ac163f74-4f47-46aa-9412-828d9ec23847 ', ' https://target.scene7.com/is/image/Target/GUEST_1fd67892-3510-443f-9ebe-8b3e30559372 ', ' https://target.scene7.com/is/image/Target/GUEST_b17cfa53-00a2-496c-a37f-6cd937aa185d']",3538bd11-b8d9-5de1-a090-70705bf6d88c,2022-06-12
47,Yogi Tea - Honey Chai Turmeric Vitality Tea - 16ct,Yogi,https://target.scene7.com/is/image/Target/GUEST_c8492955-97c4-4366-885f-fe084ca866ab,53520289,"Yogi Honey Chai Turmeric Vitality tea is an intriguing Chai tea blend that combines Turmeric, traditionally used in Ayurveda for its abundant health-promoting qualities, with naturally sweet Organic Honey Flavor and rich, warming spices including Cinnamon, Cardamom, Ginger, and Clove. Enjoy deliciously spicy-sweet Yogi Honey Chai Turmeric Vitality tea throughout the day to support your overall health and well-being.*<br /><br />BREWING SUGGESTIONS: To get the most out of every cup, bring water to boiling and steep 7 minutes. For a stronger tea, use 2 tea bags. Add your favorite sweetener and milk or milk substitute.<br /><br />FDA Statement: *These statements have not been evaluated by the FDA. This product is not intended to diagnose, treat, cure, or prevent any disease.<br /><br />Consult your healthcare provider prior to use if you are pregnant or nursing.<br />",4.29,Beverages,"['https://target.scene7.com/is/image/Target/GUEST_c8492955-97c4-4366-885f-fe084ca866ab ', ' https://target.scene7.com/is/image/Target/GUEST_225c2e09-c6e4-4cc7-8af0-6b58f4ec4ada ', ' https://target.scene7.com/is/image/Target/GUEST_501a7784-ff4d-46b8-805c-925b3d8098f3 ', ' https://target.scene7.com/is/image/Target/GUEST_a19ea2e5-2ce3-45e8-97ad-fa099273c4de ', ' https://target.scene7.com/is/image/Target/GUEST_631143b3-4fa4-4db2-bcf2-0b5235c084c4 ', ' https://target.scene7.com/is/image/Target/GUEST_501a7784-ff4d-46b8-805c-925b3d8098f3']",805226d6-a801-54df-bfa0-9631eacf3534,2022-06-12
48,Healthy Choice Café Steamers Frozen Chicken Margherita - 9.5oz,Healthy Choice,https://target.scene7.com/is/image/Target/GUEST_3b2887f0-c710-4ed7-bd9c-d75756d0ebc6,12935678,"Healthy Choice Café Steamers Chicken Margherita With Balsamic Frozen Meal satisfies your cravings with quality ingredients. Savor a quick and delicious microwaveable meal featuring true steaming technology anytime. This dish combines juicy white meat chicken, al dente angel hair pasta, roasted garlic and tomatoes tossed in a balsamic vinaigrette sauce for a meal that's as delicious as it is healthy. Made with no preservatives, this wholesome, microwave-ready meal delivers a bold experience any day of the week. Perfect for an on-the-go power lunch or a quick and delicious dinner at home after a long day, this single-serve meal contains 270 calories, 0 grams of trans fat and 17 grams of protein to keep you satisfied. Healthy Choice makes it easy to eat mindfully with bold, flavorful meals made with high-quality ingredients and contemporary recipes that are easy to prepare. Stock your freezer with a variety of Healthy Choice Café Steamers to keep healthy, wholesome meals on hand.",3.49,Frozen Foods,"['https://target.scene7.com/is/image/Target/GUEST_3b2887f0-c710-4ed7-bd9c-d75756d0ebc6 ', ' https://target.scene7.com/is/image/Target/GUEST_03363998-867a-4d3c-aea4-55eeae3ecacb ', ' https://target.scene7.com/is/image/Target/GUEST_a1cc16cc-555a-4555-a062-f1c005f5c6be']",ff0829bd-8d02-56d5-b32d-441881c13712,2022-06-12
49,Vita Coco Original Coconut Water - 4pk/500ml Cartons,Vita Coco,https://target.scene7.com/is/image/Target/GUEST_14b5e172-fb90-43d4-92b4-17355c4e7f8c,53186912,"Full of nutrients, electrolytes, and vitamins that give you a boost, which makes it great for a lot of situations, like when you're thirsty and, well... mostly when you're thirsty.",8.29,Beverages,"['https://target.scene7.com/is/image/Target/GUEST_14b5e172-fb90-43d4-92b4-17355c4e7f8c ', ' https://target.scene7.com/is/image/Target/GUEST_ff340648-ff46-4498-b9e3-b984b0a60ab6 ', ' https://target.scene7.com/is/image/Target/GUEST_4e2b75af-e38e-4169-bdff-a9404bc5e1ed']",b7b87b9c-f274-5ffa-8957-4de413efb8a8,2022-06-12
50,Grand Marnier Orange Liqueur - 750ml Bottle,Grand Marnier,https://target.scene7.com/is/image/Target/GUEST_5d5c14cd-d8db-4838-a7d6-6563461a40da,47137257,"Mix up a classic cocktail with Grand Marnier Cordon Rouge, Grand Marnier's signature expression. Created in 1880 by Louis-Alexandre Marnier Lapostolle, Grand Marnier offers a premium blend of cognacs with wild tropical oranges from the Caribbean. Grand Marnier Cordon Rouge balances the flavors of bitter orange with cognac notes of hazelnuts and toffee before reaching a long, harmonious finish. Enjoy this cognac and orange liqueur on the rocks, or mix into your favorite cocktails to elevate them from good to Grand. Use the cognac for a sophisticated twist on a Margarita, Old Fashioned or a Sidecar.  This award-winning orange liqueur is closed in the iconic, highly recognizable bottle with the wax seal. It is distinguished by the red ribbon, a symbol of its quality. The 750ml ml bottle of Grand Marnier Cordon Rouge liquor has a 40% alcohol by volume and should be enjoyed responsibly. Grand Marnier is the result of a time-honored tradition of master blenders that skillfully and carefully have passed their savoir faire onto one another since 1880. The result is an extraordinary alchemy of passion, audacity and tradition. Live Grand.",39.99,"Wine, Beer & Liquor","['https://target.scene7.com/is/image/Target/GUEST_5d5c14cd-d8db-4838-a7d6-6563461a40da ', ' https://target.scene7.com/is/image/Target/GUEST_2e23879a-88ef-4a7a-85c2-350a2077c3bc ', ' https://target.scene7.com/is/image/Target/GUEST_f2bd51a9-0299-4f71-9ac4-721e3527061e ', ' https://target.scene7.com/is/image/Target/GUEST_d580e3ca-4a66-4040-84e2-e59d0ff7ff4f ', ' https://target.scene7.com/is/image/Target/GUEST_a53c0fcd-0d88-48c6-a687-950b39c9187c']",9ea0b0e1-3a52-50e6-88a0-6cb33e746898,2022-06-12
51,Jelly Belly 49 Flavor Jelly Beans - 2lbs,Jelly Belly,https://target.scene7.com/is/image/Target/GUEST_d2d62483-66b4-4b81-b894-d3488c740c6f,12959332,"Jelly Belly makes more jelly bean flavors than anyone on the market today, and here are just a few of them - 49 to be exact! This plentiful assortment has the delicious flavors you love, and new favorites to discover. From most popular to nostalgic to unexpectedly delightful, this wide variety has something for everyone to enjoy. Snack, share, or pack into party favors. This generous bag is a great choice for so many occasions. <br /><br />True-to-life flavors in this assortment include: A&W cream soda, A&W root beer, Berry Blue, blueberry, bubble gum, buttered popcorn, cantaloupe, cappuccino, caramel corn, chocolate pudding, cinnamon, coconut, cotton candy, crushed pineapple, Dr Pepper, French vanilla, green apple, island punch, Juicy Pear, kiwi, lemon drop, lemon lime, Sunkist lemon, licorice, Sunkist lime, mango, margarita, mixed berry smoothie, orange sherbet, Sunkist orange, peach, Sunkist pink grapefruit, piña colada, plum, pomegranate, raspberry, red apple, Sizzling Cinnamon, strawberry cheesecake, Sunkist tangerine, toasted marshmallow, top banana, tutti-fruitti, Very Cherry, and watermelon.<br /><br />For generations, Jelly Belly fans have thoughtfully combined Jelly Belly jelly bean flavors to make new tastes. These Jelly Belly recipes are favorites among candy lovers with combinations like 2 A&W root beer + 1 A&W cream soda = root beer float, 2 blueberry + 1 buttered popcorn = blueberry muffin, and 2 green apple + 1 cinnamon = candy apple. Try your own combinations!<br /><br />Jelly Belly jelly beans are famous for their wide range of delicious and true-to-life flavors. With flavor packed into the center as well as the irresistible outer shell, each bite is an intense flavor adventure. The company got its start in 1898, and today makes more than 100 flavors of jelly beans worldwide. Jelly Belly jelly beans have millions of fans around the world with a flavor for everyone. Discover your new favorite flavor.<br /><br />",12.69,Candy,"['https://target.scene7.com/is/image/Target/GUEST_d2d62483-66b4-4b81-b894-d3488c740c6f ', ' https://target.scene7.com/is/image/Target/GUEST_358af9f2-cbf9-4ee8-9789-974a906d02f2 ', ' https://target.scene7.com/is/image/Target/GUEST_f9ba3d77-a42f-413b-b9e0-f2d847de5b8b ', ' https://target.scene7.com/is/image/Target/GUEST_55c6aea9-51e2-48da-b0f0-bec53a552b9c']",e5e29cd7-e1b8-55ce-a4d6-55d4572aa392,2022-06-12
52,Gatorade Cool Blue Sports Drink - 12pk/12 fl oz Bottles,Gatorade,https://target.scene7.com/is/image/Target/GUEST_2f923797-f4a3-454c-b69d-3e342d03dbbc,14756734,"The proven classic. With a legacy of over 50 years in the making, it's the most scientifically researched and game-tested way to replace electrolytes lost in sweat. Gatorade Thirst Quencher is specifically made to help keep you hydrated, which is why it's trusted by some of the world's best athletes.",6.69,Beverages,"['https://target.scene7.com/is/image/Target/GUEST_2f923797-f4a3-454c-b69d-3e342d03dbbc ', ' https://target.scene7.com/is/image/Target/GUEST_8c599bbe-b917-49b2-98f5-39a7a0208844 ', ' https://target.scene7.com/is/image/Target/5b743a360f13460001d5f02e ', ' https://target.scene7.com/is/image/Target/GUEST_a4bca240-6c4c-4cc4-8aa6-0187f3937cd4 ', ' https://target.scene7.com/is/image/Target/GUEST_691cebf9-4750-435c-ac79-b7c581dbc2ee ', ' https://target.scene7.com/is/image/Target/5b743a360f13460001d5f02e']",71d54a85-509b-5227-b6fc-af231e13637a,2022-06-12
53,Smucker's Simply Apricot Spread - 10oz,Smucker's,https://target.scene7.com/is/image/Target/GUEST_fc6cefaf-f9d3-4cf9-a81b-211a09110e02,13275915,"This delicious spread captures the essence of the apricot: nectarous, with a touch of tartness. Our Simply Fruit Apricot Speadable Fruit pairs well with Swiss cheese and is perfect for sweetening rice and couscous dishes. Sweetened with ingredients made from real fruit. With a name like Smucker's, it has to be good!",3.49,Pantry,"['https://target.scene7.com/is/image/Target/GUEST_fc6cefaf-f9d3-4cf9-a81b-211a09110e02 ', ' https://target.scene7.com/is/image/Target/GUEST_ac6360d6-38fe-412e-870d-22ba70722948 ', ' https://target.scene7.com/is/image/Target/GUEST_10d85183-0a45-4245-8b99-c94f0db06b43 ', ' https://target.scene7.com/is/image/Target/GUEST_5c8aa602-47c4-46ef-b5b4-98f3eeb3fba6 ', ' https://target.scene7.com/is/image/Target/GUEST_10d85183-0a45-4245-8b99-c94f0db06b43']",e4b97a8b-8b37-5c6a-a2dd-332202cb9d3e,2022-06-12
54,Bob's Red Mill Hemp Seed - 8oz,Bob's Red Mill,https://target.scene7.com/is/image/Target/GUEST_2ef84f39-77ec-410a-ad69-2477ab149f9a,15346430,"Bob's Red Mill Hulled Hemp Seed Hearts are beautiful little seeds with a serious nutritional bang. These raw seeds hold 10g of plant-based, vegetarian protein in each serving, plus omega-3 and omega-6 fatty acids, and a wealth of other minerals. These seeds are mild in flavor and can be almost inconspicuously added to just about any dish - salads, smoothies, pastas, yogurts, cereals, and even ice cream! They are also a great addition to baked goods such as breads and cookies or in dips, dressings, and sauces.",12.19,Snacks,"['https://target.scene7.com/is/image/Target/GUEST_2ef84f39-77ec-410a-ad69-2477ab149f9a ', ' https://target.scene7.com/is/image/Target/GUEST_e45e89a7-f12b-476a-ac08-83c80a04203a ', ' https://target.scene7.com/is/image/Target/GUEST_7eb292d0-3043-48c8-8c89-a2e440f8965f ', ' https://target.scene7.com/is/image/Target/GUEST_b9ec28a0-4270-456e-a08f-4451929fda3c ', ' https://target.scene7.com/is/image/Target/GUEST_47252820-fc94-4020-a2a1-b131df8b67aa ', ' https://target.scene7.com/is/image/Target/GUEST_7eb292d0-3043-48c8-8c89-a2e440f8965f ', ' https://target.scene7.com/is/image/Target/GUEST_47252820-fc94-4020-a2a1-b131df8b67aa']",326fda32-99a9-5667-9db9-f5c228b74345,2022-06-12
55,Tazo Classic Chai Latte Black Tea Coffee Pods – 12ct,Tazo,https://target.scene7.com/is/image/Target/GUEST_4d580844-79e9-4abc-b8a2-a7546fccab4b,79756716,"TAZO Classic Chai Latte Black Tea K-cups is a blend of black tea, cinnamon, cardamom, black pepper & spices with sweetened dairy packets included to make the perfect latte. Made with pure black tea, the spiced chai tea contains less caffeine than coffee. Each pack contains 12 individual k-cups of chai tea for your convenience. Quick and easy to make; enjoy a cafe-style latte right in your home. Then relax, and enjoy the aromatic blend hot or iced. At TAZO, we're on a quest to be the world's most unexpected tea makers. We explore unexpected blends. We tell unexpected stories to go with them. Witty, entertaining, unconventional stories of TAZO drinkers: People seeking to brew the unexpected in every aspect of their lives. We're always curious, always seeking, always questioning. What's this? What's that? We love to get right in there and mix it up. We're half curious kid, half intrepid explorer, half undaunted alchemist. Yes - one and a half. It's the unpredictable, the unforeseen that drives us. They drive us away from our safe comfort zone in a commandeered golf cart or on the first flight we could find to who knows where or to the last stop of the subway, whichever gets us to points unexplored. That spirit? We bring it to tea. We do it through vibrant, unexpected blends with a twist that unlock the undiscovered flavors the world has stashed away.",14.99,Beverages,"['https://target.scene7.com/is/image/Target/GUEST_4d580844-79e9-4abc-b8a2-a7546fccab4b ', ' https://target.scene7.com/is/image/Target/GUEST_c9e4fb95-7563-4504-85a1-5df63bb705b7 ', ' https://target.scene7.com/is/image/Target/GUEST_2b341663-0715-4e67-8e4a-043ecd33e366 ', ' https://target.scene7.com/is/image/Target/GUEST_b4308d59-181c-48d8-aea4-cadef9256a2c ', ' https://target.scene7.com/is/image/Target/GUEST_2b341663-0715-4e67-8e4a-043ecd33e366']",300b2ab9-0bea-5872-ae43-82a3ad3cd90b,2022-06-12
56,Justin's Milk Chocolate Peanut Butter Cups - 4.7oz,Justin's,https://target.scene7.com/is/image/Target/GUEST_ffe41147-fe1f-4a18-9ac7-437bc14bd756,21549972,"Pour Justin's Milk Chocolate Peanut Butter Cups into your favorite candy dish for a mini treat for everyone who stops by for a visit. They are individually wrapped, so they are the perfectly shareable snack. Or you can keep them to yourself for a quick little pick-me-up throughout your busy day.",5.99,Candy,"['https://target.scene7.com/is/image/Target/GUEST_ffe41147-fe1f-4a18-9ac7-437bc14bd756 ', ' https://target.scene7.com/is/image/Target/GUEST_03dd4308-3116-4c9f-b7b1-5d95a4fc9e95 ', ' https://target.scene7.com/is/image/Target/GUEST_3ac104da-2cdc-4a37-87dd-da02dd41dba2 ', ' https://target.scene7.com/is/image/Target/GUEST_98f0b9a7-109a-4c90-bc83-43cf01400a7b ', ' https://target.scene7.com/is/image/Target/GUEST_31e751ab-a200-4fdb-85e3-af58faede724 ', ' https://target.scene7.com/is/image/Target/GUEST_3ac104da-2cdc-4a37-87dd-da02dd41dba2']",6c3b96f8-ce46-543a-8f6d-39a71399478f,2022-06-12
57,Twizzlers Strawberry Flavored Twists - 16oz,Twizzlers,https://target.scene7.com/is/image/Target/GUEST_dbbf0fff-3d70-4040-9707-70795a45b487,50434698,"There ain't no party like a TWIZZLERS candy party! Seriously though, TWIZZLERS Twists strawberry-flavored chewy candies are too fun not to enjoy at every movie marathon, birthday party and tailgate. With a bag of strawberry-flavored chewy candies ready for action, you'll never find yourself without a delicious shareable snack. Bite both ends of a TWIZZLERS Twists candy off to create a straw, then dip your straw into a cold glass of milk, a steaming hot chocolate or a frothy milkshake. If you're more into eating a couple of these chewy treats on their own, you'll be ready to go the second you open the bag. Keep your pantry stocked with kosher-certified, low-fat TWIZZLERS Twists candies, store some in your work desk, take a bag on a road trip and bring a pack to your next party gathering. Looking for an even greater adventure? For a unique twist, melt several white or milk chocolate bars. Dip your TWIZZLERS candies in the melted gooiness, then cover each piece in sprinkles and let the new treats cool!",2.69,Candy,"['https://target.scene7.com/is/image/Target/GUEST_dbbf0fff-3d70-4040-9707-70795a45b487 ', ' https://target.scene7.com/is/image/Target/GUEST_3b804007-9a40-499e-8348-13aab5fe1574 ', ' https://target.scene7.com/is/image/Target/5acd14a32bffac0001201cfd ', ' https://target.scene7.com/is/image/Target/GUEST_d1b27640-56c0-4fdc-8fa0-e7995fe25fa7 ', ' https://target.scene7.com/is/image/Target/GUEST_83e0b795-6072-4ffd-9d78-df68e8580175 ', ' https://target.scene7.com/is/image/Target/5acd14a32bffac0001201cfd']",e6b97311-39f1-55c7-9a53-2a91c932002c,2022-06-12
58,Chicago French Press Black Tuxe Medium Roast Coffee - 8oz,Chicago French Press,https://target.scene7.com/is/image/Target/GUEST_7be27de7-cf4b-41b7-b2b0-62e6a3de1117,83223759,"Chicago French Press Black Tuxe is a premium, organic Ethiopia Yirgacheffe 100% arabica coffee sourced from the Gambela region of Ethiopia that is hand-picked, naturally processed, sun-dried and cultivated to the highest industry standards. Freshly roasted in Chicago, it brews a refined, exotic cup with fruity nuances and chocolatey undertones.",12.99,Beverages,"['https://target.scene7.com/is/image/Target/GUEST_7be27de7-cf4b-41b7-b2b0-62e6a3de1117 ', ' https://target.scene7.com/is/image/Target/GUEST_11ea70ff-5f15-4db8-979d-3c724a5c5e41 ', ' https://target.scene7.com/is/image/Target/GUEST_2fea4868-892a-4260-97d9-ec1b02cd022a']",94308079-b985-5445-be67-5fead4a68ec3,2022-06-12
59,Kisses Milk Chocolate Candy - 17.9oz,HERSHEY'S,https://target.scene7.com/is/image/Target/GUEST_c7a35f31-9a80-4a74-86d8-2c29e27da2cd,54252388,"Need to make sure the whole family is happy with the snack selection? Looking to give your employees a midday treat they actually enjoy? Whatever the case, HERSHEY'S KISSES candies have you covered. These milk chocolate classics make the perfect creamy treat throughout the day. Try some in a new dessert recipe or on top of your favorite cookie and cake treats for an extra bite of bliss your loved ones won't want to miss. Sprinkle a few over your homemade ice cream sundaes, or place them in party favors to delight guests with stunning foil wrappers and even more stunning flavor. These treats are perfect as stocking stuffers at Christmas, party favor filling during Valentine's Day, trick-or-treat candy at Halloween and basket sweets on Easter. Just don't forget to hang onto a few bite-size milk chocolates to include in your movie night snack selection and on-the-go trips. Try them chilled, on top of baked desserts and, of course, straight from the wrapper — any choice is a route straight to delicious!",5.99,Candy,"['https://target.scene7.com/is/image/Target/GUEST_c7a35f31-9a80-4a74-86d8-2c29e27da2cd ', ' https://target.scene7.com/is/image/Target/GUEST_3e423586-0272-41fb-b4ce-1eb0f360aee4 ', ' https://target.scene7.com/is/image/Target/GUEST_4e2804c0-935f-4c12-8ca2-54d117d12f21 ', ' https://target.scene7.com/is/image/Target/GUEST_1e127e77-57d8-4105-b64a-c915590aa9f7 ', ' https://target.scene7.com/is/image/Target/GUEST_852a0e66-6e52-4ee8-a759-f6e18dc60a24 ', ' https://target.scene7.com/is/image/Target/GUEST_4e2804c0-935f-4c12-8ca2-54d117d12f21']",ac871715-6c86-57fa-824b-fb19370b53f4,2022-06-12
61,Goldfish Special Edition Mickey Mouse Cheddar Crackers - 30oz,Goldfish,https://target.scene7.com/is/image/Target/GUEST_45a160d9-7623-4c06-a716-d8bcd3bc6b57,78648485,"A special edition twist on the irresistible little snack that always delights! Just imagine munching on Goldfish snack crackers featuring Disney’s Mickey Mouse. Shaped like your favorite cartoon friend, they’re baked with 100% real Cheddar cheese and made with colors sourced from plants. Talk about a feel-good snack! These Mickey Mouse-inspired munchables are as fun as it gets. And they make the perfect anytime snack – after school, on the weekends or whenever you just spend time together. Snack time with friends is always sure to end up in smiles all around. Plus, they’re every bit as good at lunch as they are for a crunchable, munchable snack. Add them to soups, sprinkle them on salads or just simply munch on them as a fun side with your sandwich. Expect everyone to come back for more. Go for the handful!",7.99,Snacks,"['https://target.scene7.com/is/image/Target/GUEST_45a160d9-7623-4c06-a716-d8bcd3bc6b57 ', ' https://target.scene7.com/is/image/Target/GUEST_a5524ff5-ca39-4e9e-b205-27b546f956c6 ', ' https://target.scene7.com/is/image/Target/GUEST_0b3ef46a-ba04-46df-8465-ae6438266741 ', ' https://target.scene7.com/is/image/Target/GUEST_23c6a41f-e08d-4809-ad9c-63b4ded84203 ', ' https://target.scene7.com/is/image/Target/GUEST_b3efc96b-3874-44be-82da-6828f50aca42']",fd4ab7fc-7fe1-51ca-8739-278d9424d451,2022-06-12
