,title,marque,image_principale,sku,description,prix,category,images,uniq_id,expiration
22,Ore-Ida Just Crack an Egg Omelet Rounds Three Meat Egg Bites - 4.6oz,Ore-Ida,https://target.scene7.com/is/image/Target/GUEST_49045abf-b654-46cc-b312-51cc3c476c38,82224090,"A protein-packed breakfast to add some spring to your step? Get outta here! Enjoy a hot, fluffy omelet in under two minutes with Just Crack an Egg Omelet Rounds. Made with cage free eggs*, our Just Crack an Egg Omelet Rounds Three Meat Egg Bites are filled with pork sausage, uncured bacon, uncured ham and cheddar cheese. Our Three Meat Omelet Rounds are packed with 18 grams of protein per serving. For a quick and easy breakfast at home or on the go, simply remove the film, microwave in the tray for 50 seconds and let cool before eating. Try eating our egg bites cold for a protein-packed breakfast or snack anytime. Each fluffy omelet bite has no artificial flavors, dyes or preservatives. Keep our egg bites refrigerated until you’re ready to eat. 

*Made with eggs from chickens never confined to cages",3.19,Deli,"['https://target.scene7.com/is/image/Target/GUEST_49045abf-b654-46cc-b312-51cc3c476c38 ', ' https://target.scene7.com/is/image/Target/GUEST_23b3ade3-c9ad-4bac-ae2b-6424151b6936 ', ' https://target.scene7.com/is/image/Target/GUEST_b59eb64d-b01b-485d-822d-6ce4ba3e6119 ', ' https://target.scene7.com/is/image/Target/GUEST_0809683d-d51f-418c-8191-ec12416c57cc ', ' https://target.scene7.com/is/image/Target/GUEST_68ac8ba6-c7a5-4233-8dfc-302f0f6632bd']",67164d8b-9017-5a44-859a-8409d9d5da47,2022-06-12
23,Devils Backbone Vienna Lager Beer - 15pk/12 fl oz Cans,Devils Backbone Brewing Company,https://target.scene7.com/is/image/Target/GUEST_3c91dd5b-194b-4199-9052-16b0a42937ec,54085099,"Devils Backbone Brewing Company Vienna Lager is a beer with mild, toasted and caramel notes. This smooth, medium bodied and semi sweet craft beer is not too heavy or bitter. It has an amber chestnut color, a smooth, malty finish and a 5.2% ABV. 15 pack.",17.99,"Wine, Beer & Liquor","['https://target.scene7.com/is/image/Target/GUEST_3c91dd5b-194b-4199-9052-16b0a42937ec ', ' https://target.scene7.com/is/image/Target/GUEST_8e1c556e-5ac8-4e20-9883-1f56af778cb6 ', ' https://target.scene7.com/is/image/Target/GUEST_6d4167df-5b85-4b27-90e4-8280a987c113 ', ' https://target.scene7.com/is/image/Target/GUEST_df258c37-9012-47e5-a876-cf68a4f6c848 ', ' https://target.scene7.com/is/image/Target/GUEST_222c990d-fc81-48bf-bc6b-005390b87f8b']",e3b6a34f-f049-5056-b9f6-9b8c583d4208,2022-06-12
24,Good Culture Organic Whole Milk Classic Cottage Cheese - 16oz,good culture,https://target.scene7.com/is/image/Target/GUEST_32bc7b04-72e3-4dcf-865f-026e48806abe,82026075,"At Good Culture, our mission is to make real healing foods available to all, without hurting animals or our planet.  Made from stuff you can pronounce, produced by people who love the planet and really, really like cottage cheese.  The little black dress of the dairy world. You can never go wrong with a classic! Creamy Organic Cottage Cheese from pasture-raised cows. Our recipe for delicious is simple; we use organic milk, organic cream, celtic sea salt, and live & active cultures. Nothing else. Got it? Good.",4.99,Dairy,"['https://target.scene7.com/is/image/Target/GUEST_32bc7b04-72e3-4dcf-865f-026e48806abe ', ' https://target.scene7.com/is/image/Target/GUEST_37439ddf-bfab-4a68-951e-be8f098faf7d ', ' https://target.scene7.com/is/image/Target/GUEST_2541d74e-5409-48df-8afe-2374dc300a83 ', ' https://target.scene7.com/is/image/Target/GUEST_64a8545a-c54a-4270-ba03-d58fb584d346 ', ' https://target.scene7.com/is/image/Target/GUEST_23f74633-73c7-4058-8da9-56133bd2f1d4 ', ' https://target.scene7.com/is/image/Target/GUEST_2541d74e-5409-48df-8afe-2374dc300a83']",6a0b1575-13eb-5d96-8736-60857178927e,2022-06-12
26,Shake 'N Bake Extra Crispy Seasoned Coating Mix - 5oz,Shake 'N Bake,https://target.scene7.com/is/image/Target/GUEST_77d5ce57-e2ad-4b94-90a7-96cde23118a0,12953792,"Kraft Shake 'N Bake Extra Crispy Seasoned Coating Mix adds a crispy crust to your chicken without the mess of frying for a quick home-style meal. This crispy coating is perfectly seasoned with savory flavors for a delicious, irresistible crunch. For simple prep, moisten the chicken, shake it in the coating and bake it until it's fully cooked. Use it with bone-in or boneless chicken to make crispy baked chicken, a crispy chicken sandwich or easy chicken nuggets. Each 5 ounce box contains two pouches of chicken coating, so you can enjoy more than one family dinner over oven baked crispy chicken. This extra-crispy chicken seasoning is all you need to take your home-style chicken from good to incredible.",3.59,Pantry,"['https://target.scene7.com/is/image/Target/GUEST_77d5ce57-e2ad-4b94-90a7-96cde23118a0 ', ' https://target.scene7.com/is/image/Target/GUEST_0d0197a0-4a27-44e5-a878-cb77e4aa3804 ', ' https://target.scene7.com/is/image/Target/GUEST_ebf6e1ba-7933-4744-ac0d-83123b9b6290 ', ' https://target.scene7.com/is/image/Target/GUEST_39390dee-8a52-4bb0-876c-6c2d91ab894b ', ' https://target.scene7.com/is/image/Target/GUEST_f49cca74-5964-4c80-bee2-9f1328a5b37a']",bb0192ef-0dad-529b-a3ef-004c6cc8c805,2022-06-12
27,Old El Paso Gluten Free Crunchy Taco Shells - 6.89/18ct,Old El Paso,https://target.scene7.com/is/image/Target/GUEST_c2ac0ccd-c8c7-4f2f-93dc-c246889ddf78,13043722,"Feed the taco frenzy with an 18-count package of Old El Paso Crunchy Taco Shells. Made with only three ingredients, these gluten-free hard taco shells add a satisfying crunch to taco night. Simply add your favorite meats, cheeses, beans and fresh toppings for tasty tacos that are easily customized to make the whole family happy. Tonight, we taco!

For more than 80 years, Old El Paso has been bringing families and communities together to celebrate old and new traditions around delicious, Mexican-inspired flavors. We believe that any night can be a taco night, and we’re here to help make it a little easier and a lot more delicious. Our variety of crispy hard taco shells, tasty soft tortillas, flavorful seasonings, and much more help make taco night fun.",2.69,Bakery & Bread,"['https://target.scene7.com/is/image/Target/GUEST_c2ac0ccd-c8c7-4f2f-93dc-c246889ddf78 ', ' https://target.scene7.com/is/image/Target/GUEST_8ee99bc6-a5a9-44f3-83b0-88bc53f9f9b4 ', ' https://target.scene7.com/is/image/Target/GUEST_db6b4a55-e2e4-4f7e-a782-86ee2a2356e2 ', ' https://target.scene7.com/is/image/Target/GUEST_1e4f9e7d-e26b-4dc0-b07c-6c20f9e125aa ', ' https://target.scene7.com/is/image/Target/GUEST_d06a94e9-78e5-463e-8c1b-575f5c56560e ', ' https://target.scene7.com/is/image/Target/GUEST_db6b4a55-e2e4-4f7e-a782-86ee2a2356e2']",18971e18-0544-558d-8cea-0f62d3a6e922,2022-06-12
28,Del Monte Fresh Cut Sliced Carrots 8.25oz,Del Monte,https://target.scene7.com/is/image/Target/GUEST_379e1c4d-5594-4113-8086-1291c9080e3d,12935365,"The Del Monte Canned Sliced Carrot, with their flavor, complement All of your favorite recipes and different types of dishes, salads, drinks, and desserts. These delicious slices are a tasty topping for yogurt, cereal, salads, and your favorite flavored gelatin for a fun and tasty treat. The fruit, immersed in a Naturally refreshing fruit juice, will elevate any dish you make to another level. They contain much-needed nutrition apart from vitamins A and C. They also contain calcium and iron, which are beneficial for your body and health. The peach slices are the perfect snack to be eaten on-the-go and with whatever you desire. When you trust Del Monte, you can be sure what you're buying is the peak of quality and nutrition! The Del Monte name has been synonymous with premium foods since its debut in 1886. For generations, our company has proudly earned its reputation with a series of innovations and a singular dedication to quality. Today that commitment to quality is deeply embedded in our culture.",0.99,Pantry,"['https://target.scene7.com/is/image/Target/GUEST_379e1c4d-5594-4113-8086-1291c9080e3d ', ' https://target.scene7.com/is/image/Target/GUEST_1dd82afa-bba2-472f-975b-c1d662452f02 ', ' https://target.scene7.com/is/image/Target/GUEST_41acaa10-eb05-41cb-a27c-329ad287c4a9 ', ' https://target.scene7.com/is/image/Target/GUEST_902b9ff9-4656-4d22-a851-4a9ea7678ce3 ', ' https://target.scene7.com/is/image/Target/GUEST_41acaa10-eb05-41cb-a27c-329ad287c4a9']",049bb360-0550-5309-8c02-5f59de06f9df,2022-06-12
29,Summit Extra Pale Ale Beer - 12pk/12 fl oz Bottles,Summit Brewing Co.,https://target.scene7.com/is/image/Target/GUEST_ddd24e65-b712-4fa4-a98f-5341ff2de8fd,47912959,"Summit Extra Pale Ale is not a beer brewed only for beer snobs. Just the opposite. It’s a beer for everyone to enjoy: construction workers, stock brokers, farmers, sales people, clerks, teachers, lawyers, doctors, even other brewers. Its light bronze color and distinctly hoppy flavor have made it a favorite in St. Paul, Minneapolis and the rest of the Upper Midwest ever since we first brewed it back in 1986.12oz 12Pk",15.99,"Wine, Beer & Liquor","['https://target.scene7.com/is/image/Target/GUEST_ddd24e65-b712-4fa4-a98f-5341ff2de8fd ', ' https://target.scene7.com/is/image/Target/GUEST_74ffeec1-29e7-4625-967a-61ae142e32ab ', ' https://target.scene7.com/is/image/Target/GUEST_06e66c44-7ed1-435e-b170-3fc082014d38']",aa0bf0fb-f10e-5df2-81ef-57a5c3cde8ca,2022-06-12
30,Oikos Triple Zero Variety Pack Greek Yogurt - 6ct/5.3oz Cups,DANNON,https://target.scene7.com/is/image/Target/GUEST_cfd38a75-37e9-4cb2-9a4d-a2ce63b08e89,80859172,"Oikos Triple Zero Greek Nonfat Yogurt gives you all the flavor you seek in a Greek yogurt--but with 0 added sugar*, 0 artificial sweeteners, and 0 fat, with 15 grams of protein per 5.3 oz cup. Full of delicious strawberry (or mixed berry) flavor, this Greek nonfat yogurt makes a delicious snack any time of day. It also fits into a healthy lifestyle, providing important nutrients such as calcium, protein, and vitamin D. And for your convenience, Oikos Triple Zero Greek Nonfat Yogurt comes packaged in single-serve cups, perfect for snacking on the go. <br /><br /> <br />*Not a low-calorie food.<br />Discover yogurt and dairy products that are made for you with Oikos. Want the creamy one with the fruit chunks? We got you. Need 0 sugar, 0 artificial sweeteners, and 0 fat? Try Oikos Triple Zero. Looking for extra protein? Oikos Pro has 20g per serving. With our wide selection of creamy yogurts, you’re bound to find an epic food experience that sparks pure joy. Dig into deliciousness with Oikos.",5.29,Dairy,"['https://target.scene7.com/is/image/Target/GUEST_cfd38a75-37e9-4cb2-9a4d-a2ce63b08e89 ', ' https://target.scene7.com/is/image/Target/GUEST_970a81bd-eed0-45eb-a424-1c6ed9502419 ', ' https://target.scene7.com/is/image/Target/GUEST_456b0b48-d01b-4fbb-b0f5-7c70f6045baf ', ' https://target.scene7.com/is/image/Target/GUEST_3c03f32a-2e7f-4b46-9e1d-7245a00d8ca2 ', ' https://target.scene7.com/is/image/Target/GUEST_19dbe207-b13d-4776-a184-e52b2263c3b8']",b021ef51-2db4-524d-8e02-14ffbf3af826,2022-06-12
31,Sixpoint The Crisp Pilsner Beer - 6pk/12 fl oz Cans,Sixpoint Brewery,https://target.scene7.com/is/image/Target/GUEST_a9ea9eef-f2c0-4531-8aec-eda1dc1c367d,52162197,"Tettnang and Hallertau Hops, 100% sourced directly from Germany, give THE CRISP that signature floral aroma. Cargill Pilsner Malt is the backbone, and helps make the finish snappy and clean.<br />Legit pilz has a hop aroma that leaps from the glass   THE CRISP blasts you with a huge floral aroma, but finishes crisp, clean, and refreshing.",9.99,"Wine, Beer & Liquor","['https://target.scene7.com/is/image/Target/GUEST_a9ea9eef-f2c0-4531-8aec-eda1dc1c367d ', ' https://target.scene7.com/is/image/Target/GUEST_b9c5bc80-1a29-47c6-8c55-2d16c67ff1ac ', ' https://target.scene7.com/is/image/Target/GUEST_eb18c008-8646-4353-99cf-f632159d425a']",8b0652c8-4157-55b9-af71-0798dbd606b7,2022-06-12
32,Josh Pinot Grigio White Wine - 750ml Bottle,Josh Cellars,https://target.scene7.com/is/image/Target/GUEST_b8a83d1b-e4fc-4633-93e9-4828c3975c14,52051006,"Our Pinot Gris, from the cool climate of Washington, is expressive and crisp with flavors of citrus and mango.   Pairs well with sauteed scallops, fettucine alfredo or roasted butternut squash.",12.99,"Wine, Beer & Liquor","['https://target.scene7.com/is/image/Target/GUEST_b8a83d1b-e4fc-4633-93e9-4828c3975c14 ', ' https://target.scene7.com/is/image/Target/GUEST_fb19a6aa-3d81-44d2-a0ff-09fdc63fff71 ', ' https://target.scene7.com/is/image/Target/GUEST_ed214fb6-b229-4e5b-b67c-cfc8a877bbb4 ', ' https://target.scene7.com/is/image/Target/GUEST_5354a1f3-5ea0-4eab-b6ad-02691779400b ', ' https://target.scene7.com/is/image/Target/GUEST_ed214fb6-b229-4e5b-b67c-cfc8a877bbb4']",e9336bb2-7ce1-5776-b985-a45aa1b39469,2022-06-12
33,"McCormick Gluten Free Pink Sea Salt, Black Pepper, Garlic All Purpose Seasoning - 6.5oz",McCormick,https://target.scene7.com/is/image/Target/GUEST_9fea0459-511e-4f8a-9e04-c5a9119a944c,54468917,"McCormick Himalayan Pink Salt with Black Pepper and Garlic All Purpose Seasoning is made for the meals you’re eating today. With its unique blend of garlicky meets citrusy and sweet, it’s got just the right flavors for beef, chicken, meatless dishes and more. A flavorful blend of Himalayan pink salt, black pepper, garlic and lemon peel, this convenient seasoning can be added to dishes without even measuring. Shake it on in the kitchen, at the table or on the grill! Use it in the morning on avocado toast or breakfast wraps straight through to dinner in stir-fries, grain bowls and meat(less) dishes to dial up flavor in a big modern way. This versatile seasoning is sure to be a favorite!",4.49,Pantry,"['https://target.scene7.com/is/image/Target/GUEST_9fea0459-511e-4f8a-9e04-c5a9119a944c ', ' https://target.scene7.com/is/image/Target/GUEST_658bdd61-fc00-4209-be9e-09e9c2df32b8 ', ' https://target.scene7.com/is/image/Target/GUEST_b45370a9-f1e8-4f88-9940-ace02322582f ', ' https://target.scene7.com/is/image/Target/GUEST_c2015543-f3fc-4516-b831-7c930562326d ', ' https://target.scene7.com/is/image/Target/GUEST_098d5318-f68b-4064-a94b-1351b01833c3 ', ' https://target.scene7.com/is/image/Target/GUEST_b45370a9-f1e8-4f88-9940-ace02322582f']",9bed0cd2-6cd6-5c14-a746-3c5bbc133787,2022-06-12
34,Annie's Organic Cinnamon Rolls with Icing - 17.5oz/5ct,Annie's,https://target.scene7.com/is/image/Target/GUEST_100b7f65-20e8-4334-b1ba-f3ab2a5c9137,51021939,"Sweeten up your morning with Annie’s Organic Cinnamon Rolls! Made with the goodness of Annie’s, our yummy cinnamon rolls are made with high-quality ingredients and no artificial flavors, hydrogenated oils or high-fructose corn syrup. Even sweeter, our ready-to-bake cinnamon rolls come with a side of old-fashioned icing for swirled-on deliciousness. Simply place flat on a cookie sheet and bake at 350 degrees for 18-20 minutes. Then, slather your cinnamon rolls in creamy icing and prepare to devour. Head over to the refrigerated dough aisle and grab a can of five organic cinnamon rolls!

Annie's makes products in over 20 family-friendly categories — from fruit-flavored snacks and cereal to mac & cheese. For busy bunnies and families on the go, we help make life a little easier and more delicious by sweetening-up packed lunches or by adding to a savory, yummy dinner. Annie’s is devoted to spreading goodness through nourishing, tasty foods and kindness to the planet.",5.59,Dairy,"['https://target.scene7.com/is/image/Target/GUEST_100b7f65-20e8-4334-b1ba-f3ab2a5c9137 ', ' https://target.scene7.com/is/image/Target/GUEST_5858c2c3-a43f-4c71-b462-3c9789777222 ', ' https://target.scene7.com/is/image/Target/GUEST_bb7313bc-ef01-4551-b724-f405ffbf22ec ', ' https://target.scene7.com/is/image/Target/GUEST_8c5a3b7a-777b-42d5-9495-1b98b32c7f0c ', ' https://target.scene7.com/is/image/Target/GUEST_7b71412d-ad43-47de-9c7c-39ea5bc0e7ab ', ' https://target.scene7.com/is/image/Target/GUEST_bb7313bc-ef01-4551-b724-f405ffbf22ec']",ea548645-f376-54bf-ba90-d98bd1eaad28,2022-06-12
35,Knorr Pasta Sides Fusili with Cheddar Broccoli - 4.3oz,Knorr,https://target.scene7.com/is/image/Target/GUEST_06be3fc7-bfa2-49c1-9fc8-0643ce5ffa4b,12935696,"Treat your taste buds to Knorr Pasta Side's Cheddar Broccoli Fusilli Pasta. Our pasta side dish expertly combines broccoli florets and fusilli pasta with a creamy, cheddar cheese sauce; your family is sure to love the flavor of our easy pasta dishes. On top of tasting delicious, our Cheddar Broccoli pasta is quick and easy to prepare. Knorr pasta side dishes cook in just 10 minutes on the stovetop or in the microwave, and they’re perfect as the base for a delicious main dish or as a standalone rice side dish. Make Knorr Pasta Sides the foundation of a crowd-pleasing dinner or an easy meal.<br /><br />Knorr Pasta Sides have no artificial flavors or preservatives, and no added MSG, except those naturally occurring glutamates. Use these easy pasta side dishes to create a mouthwatering main dish. Simply prepare Knorr Pasta Sides and add your favorite meat and vegetables to make a dinner your family is sure to love. You can find great recipes from Knorr, like our chef-inspired Chicken & Garden Vegetables.<br /> <br />Discover more quick and delicious dinner ideas at Knorr.com. Hundreds of recipes are available to help you find dinner inspiration. We at Knorr believe that good food matters, and everyday meals can be just as magical as special occasions. Our products owe their taste and flavors to the culinary skills and passion of our chefs, and we source high-quality ingredients to create delicious side dishes, bouillons, sauces, gravies, soups, and seasonings enjoyed by families everywhere.",1.39,Pantry,"['https://target.scene7.com/is/image/Target/GUEST_06be3fc7-bfa2-49c1-9fc8-0643ce5ffa4b ', ' https://target.scene7.com/is/image/Target/GUEST_2e20c1a4-5638-4d51-9c66-6f0ae13a4b06 ', ' https://target.scene7.com/is/image/Target/GUEST_c27fc8fc-0de1-4330-b1aa-b3d664ea5266 ', ' https://target.scene7.com/is/image/Target/GUEST_6485bac0-81cb-4922-bd8d-a634e73ab916 ', ' https://target.scene7.com/is/image/Target/GUEST_cef77fe1-9397-4500-bfb6-303b56bb6cfc ', ' https://target.scene7.com/is/image/Target/GUEST_c27fc8fc-0de1-4330-b1aa-b3d664ea5266']",78795ce7-79c4-507c-ba9a-7861751d62a7,2022-06-12
36,Shaved Parmesan Cheese Cup - 5oz - Good & Gather™,Good & Gather,https://target.scene7.com/is/image/Target/GUEST_abdc1f0b-b640-4f8f-a0aa-fa7f015997bb,54589394,"Put an elegant finishing touch on any dish while adding a hint of extra flavor with the Shaved Parmesan Cheese from Good & Gather™. Featuring the hard texture and subtle, nutty flavor you expect from high-quality Parmesan, this shaved cheese is aged for 10 months to achieve its distinctive flavor, and the five-ounce package is the ideal size for keeping on hand. Use it to add a perky finishing touch to your lasagna or to add a little extra flavor and flourish to dinner salads, or simply add it to a cheese board and serve with fruit, preserves and water crackers for a mouthwatering appetizer choice that's sure to please. <br /><br />Every product that carries the Good & Gather name starts with quality ingredients that deliver great taste, making it easier for you and your family to eat well, every day. We promise you'll love each bite, or your money back.",3.99,Deli,"['https://target.scene7.com/is/image/Target/GUEST_abdc1f0b-b640-4f8f-a0aa-fa7f015997bb ', ' https://target.scene7.com/is/image/Target/GUEST_6c15c839-df86-4d00-bdb3-4e0e5c7f02ff ', ' https://target.scene7.com/is/image/Target/GUEST_df6d15a3-4ebe-4634-b638-2e6fc3efc59a ', ' https://target.scene7.com/is/image/Target/GUEST_bb3d12e4-0846-46d0-ab04-d0793486fe62 ', ' https://target.scene7.com/is/image/Target/GUEST_df6d15a3-4ebe-4634-b638-2e6fc3efc59a']",4cd4b714-51db-528d-9cf6-0018aa57159c,2022-06-12
37,Idahoan Gluten Free Baby Reds Mashed Potatoes - 4oz,Idahoan,https://target.scene7.com/is/image/Target/GUEST_251ab437-9c2b-4317-8dea-3378683477cd,14773141,"Whip up delicious, rich mashed potatoes in minutes with Idahoan Baby Reds Mashed Potatoes! Our instant mashed potatoes are always made with 100-Percent Real Idaho potatoes. Perfect for a variety of wholesome recipes, Idahoan Baby Reds Mashed Potatoes are easy to prepare and ready in minutes. Simply heat water on stovetop or in a microwave, add the entire pouch of mashed potatoes, and voilà! Each order includes 1 (4.1oz) pouch with 4 (1/2 cup) servings. Our mission of innovation will continue to bring you quality 100-percent REAL Idaho potatoes in all the ways you love.  Whether it’s quality mashed potatoes, soups, casseroles or hash browns, in a pouch, bowl, cup or more, Idahoan Foods will continue to bring you Homemade Taste—Every Time",1.19,Pantry,"['https://target.scene7.com/is/image/Target/GUEST_251ab437-9c2b-4317-8dea-3378683477cd ', ' https://target.scene7.com/is/image/Target/GUEST_98adb85d-c7d9-47b0-94ec-ae0c9ea60145 ', ' https://target.scene7.com/is/image/Target/GUEST_c3ed1c03-904f-4257-90ae-fbd6822036c3']",3678cc68-3595-5053-b0ec-429490a695b1,2022-06-12
38,Absolut Lime & Cucumber Sparkling Vodka Soda - 4pk/355ml Cans,Absolut,https://target.scene7.com/is/image/Target/GUEST_eace27cd-9e10-468d-823c-5692c27f2d11,79341660,"A high quality – low calorie drink, ready to be enjoyed with just the flick of the wrist. Inspired by the iconic, go-to drink but with an added twist, our Absolut Vodka Sodas are your perfectly balanced premix made perfect for any occasion, free from any artificial ingredients and full of natural flavors. With Absolut Vodka and the taste of either Raspberry & Lemongrass, Lime & Cucumber or Grapefruit & Rosemary, the question is not whether you have found your favorite drink for the summer, but which one is your pick.",12.99,"Wine, Beer & Liquor","['https://target.scene7.com/is/image/Target/GUEST_eace27cd-9e10-468d-823c-5692c27f2d11 ', ' https://target.scene7.com/is/image/Target/GUEST_d344b9d0-ae55-4990-8917-29eb2148e38e ', ' https://target.scene7.com/is/image/Target/GUEST_3268e8a8-e82b-4a68-af58-5b6a52340321']",0b8209e3-a97b-560d-84b6-54b391682745,2022-06-12
39,Bota Box Sauvignon Blanc White Wine - 3L Box,Bota Box,https://target.scene7.com/is/image/Target/GUEST_feb81859-7663-4f76-8d60-375162cb2d49,80279643,"Bota Box wines are always ready for an adventure. Packaged using sustainable materials and a resealable spout that keeps light and air out, you can enjoy quality wines anywhere, anytime for up to 30 days after opening. So whether your plans include a weekend camping trip or a movie night in with your dog, the full-bodied flavor of Bota Box white wine pairs perfectly with all of life’s adventures.",18.99,"Wine, Beer & Liquor","['https://target.scene7.com/is/image/Target/GUEST_feb81859-7663-4f76-8d60-375162cb2d49 ', ' https://target.scene7.com/is/image/Target/GUEST_303a8c12-7531-47b1-bb7e-bd4b02d9abb2 ', ' https://target.scene7.com/is/image/Target/GUEST_eb20631c-deee-46df-a3ea-27afe873a7ab ', ' https://target.scene7.com/is/image/Target/GUEST_031b173c-c5a8-4094-878f-5d4ab5805a4b ', ' https://target.scene7.com/is/image/Target/GUEST_41c055b8-4ac4-4e30-a314-9268a1ff9985 ', ' https://target.scene7.com/is/image/Target/GUEST_eb20631c-deee-46df-a3ea-27afe873a7ab']",90ddf902-2fe7-5c08-b4bf-a6990449516b,2022-06-12
40,Tootsie Fruit Chews Standup Bag – 37oz,Tootsie,https://target.scene7.com/is/image/Target/GUEST_9cd539e1-ed8b-4268-9362-7a88e07e4c70,81643146,"Offering the same look and chew as the original Tootsie Roll in fruit-flavored varieties, Tootsie Fruit Chews are equally tasty candy treats. The individally wrapped, bite-sized treats are available in five great tasting flavors: Cherry, Lemon, Vanilla, Orange, and Lime. Pefect for parties, holidays, parades, or for keeping for yourself. Peanut free and Gluten free.",6.99,Candy,"['https://target.scene7.com/is/image/Target/GUEST_9cd539e1-ed8b-4268-9362-7a88e07e4c70 ', ' https://target.scene7.com/is/image/Target/GUEST_d4129f35-54d3-4b0b-9556-21ea01ed97f1 ', ' https://target.scene7.com/is/image/Target/GUEST_656a714d-0890-4baa-a55f-457dd637328a ', ' https://target.scene7.com/is/image/Target/GUEST_56840534-a214-49d9-984f-4592764bd5a8 ', ' https://target.scene7.com/is/image/Target/GUEST_e0ab53b0-7382-4005-af37-23c7690c2275']",e44fb6d4-4800-5b0d-99c2-0ecfe8e22f60,2022-06-12
