,title,marque,image_principale,sku,description,prix,category,images,uniq_id,expiration
0,Goya Chorizos - 3.5oz,GOYA,https://target.scene7.com/is/image/Target/GUEST_e5baf9e7-4476-402a-9c59-304dfa87c676,47112125,"Goya Chorizo, 3.5 Ounce | GOYA Chorizo is a delicious spanish dry hot sausage with a great texture and spiced with traditional seasonings. Perfect for everyday cooking in omlettes, as party snacks, or simply on it's own, Goya Chorizo is a delicious pantry staple that is sure to be a family favorite. Naturally smoked, and meaty and tasty on its own, Goya Chorizo also adds loads of flavor to rice dishes and stews—and of course, it makes fantastic tapas dishes! If it's Goya ... it has to be good!",3.29,Pantry,"['https://target.scene7.com/is/image/Target/GUEST_e5baf9e7-4476-402a-9c59-304dfa87c676 ', ' https://target.scene7.com/is/image/Target/GUEST_fbbfea04-637e-4b16-a8b0-47c62aeb834d ', ' https://target.scene7.com/is/image/Target/GUEST_d56f3321-c120-4b3e-85ee-13ee4c8d0141']",57da2e50-60fd-5831-b9dd-eac14ae3cfcc,2022-06-12
1,Tyson Grilled & Ready Oven Roasted Diced Chicken Breast - Frozen - 22oz,Tyson,https://target.scene7.com/is/image/Target/GUEST_89fac4a8-d4c6-400a-9ba1-571bfbbfb9a1,14778739,"Made with chicken raised with no antibiotics ever and no added hormones or steroids, Tyson Grilled and Ready Fully Cooked Diced Oven Roasted Chicken Breast is a delicious addition to any meal. These oven roasted frozen chicken breasts are seasoned, diced and oven roasted to perfection. Simply toss this seasoned chicken with fresh vegetables, pasta and a splash of olive oil for a delicious weeknight dinner. With high quality farm raised chicken with no antibiotics ever, we keep it real in everything we do. Keep it real. Keep it Tyson. *Minimally processed, no artificial ingredients.
",10.39,Meat & Seafood,"['https://target.scene7.com/is/image/Target/GUEST_89fac4a8-d4c6-400a-9ba1-571bfbbfb9a1 ', ' https://target.scene7.com/is/image/Target/GUEST_41fad055-cf89-418c-9a14-a597f347488e ', ' https://target.scene7.com/is/image/Target/GUEST_d55e328f-92d4-4c90-8d46-aa493fa7b3f2 ', ' https://target.scene7.com/is/image/Target/GUEST_d67bf7a2-6417-41a0-9f60-4d25779462f0 ', ' https://target.scene7.com/is/image/Target/GUEST_38980bc6-2023-4eec-be00-b5d6e7e7cafe']",ca4c17da-bbd4-53bd-a596-78c42096b2df,2022-06-12
2,The Drunken Goat Semi Soft Goat Cheese Bathed in Red Wine - 6oz,Drunken Goat,https://target.scene7.com/is/image/Target/GUEST_f2eb83be-c3f0-4fa0-92aa-14e2ce69bf7b,14929058,"Literally meaning ''goat with wine'' this semi-firm pasteurized goat from Spain's Mediterranean coast is cured for 48-72 hours in Doble Pasta red wine. The paste remains nearly pure white and the rind absorbs a lovely violet hue. The paste is sweet and smooth, delicately grapey, with a gentle, pliable texture and mild fruity flavor. ",9.39,Deli,"['https://target.scene7.com/is/image/Target/GUEST_f2eb83be-c3f0-4fa0-92aa-14e2ce69bf7b ', ' https://target.scene7.com/is/image/Target/GUEST_a683b4ac-855e-4c7c-a8db-16ecd382d560 ', ' https://target.scene7.com/is/image/Target/GUEST_fd7c3886-fdf6-42b3-978c-23039ef7fa2d']",dc088ee6-4467-55ab-904b-c851ed1f85b2,2022-06-12
3,Bud Light Beer - 18pk/12 fl oz Bottles,Bud Light,https://target.scene7.com/is/image/Target/GUEST_03c3d05f-413a-4e8d-bf1f-d08dd034dd31,13392479,"Bud Light is brewed using barley malts, rice and a blend of premium aroma hop varieties and has a fresh, clean taste. This lager delivers a crisp finish. Bud Light is made with no preservatives or artificial flavors and has a 4.2% ABV. 18 pack of bottles.",17.99,"Wine, Beer & Liquor","['https://target.scene7.com/is/image/Target/GUEST_03c3d05f-413a-4e8d-bf1f-d08dd034dd31 ', ' https://target.scene7.com/is/image/Target/GUEST_a16cd46f-1582-4329-a8ab-83472f7f7030 ', ' https://target.scene7.com/is/image/Target/GUEST_cbea7d44-c36d-4eff-a968-32747dd37291 ', ' https://target.scene7.com/is/image/Target/GUEST_4a2ae2c0-4c3a-4672-b7d5-493da952f15f ', ' https://target.scene7.com/is/image/Target/GUEST_bce8e3d7-eebf-47c1-af59-2cc04257bf37']",e7e5d6e1-9850-513c-9b8d-a94424feab7e,2022-06-12
4,J. Lohr Estates Flume Crossing Sauvignon Blanc - 750ml Bottle,J. Lohr,https://target.scene7.com/is/image/Target/GUEST_7297f261-dae3-43f6-9cb2-39018f7ae4c8,81785851,"The grapes for the Flume Crossing Sauvignon Blanc are grown in the well-drained, sandy, cobblestone soils deposited by the Arroyo Seco River. These rugged soils keep yields in check and produce fruit with varietal intensity, minerality and exceptional weight. The long cool growing season of the Arroyo Seco appellation ensures that the fleeting, exotic fruit flavors of Sauvignon Blanc are retained along with a vibrant natural acidity. The Flume Crossing Sauvignon Blanc is created to be an expression of pure varietal character, influenced only by its terroir, gently guided by minimal farming and winemaking practices. Pale yellow in color and displays aromas of honeysuckle, sweet herbs, lime, and fig. These aromas are complemented on the palate by the bright flavors of grapefruit, kiwi, passionfruit, and lemongrass, with the rich texture and long finish provided by the acacia barrels. This wine has earned the Certified California Sustainable seal.",12.99,"Wine, Beer & Liquor","['https://target.scene7.com/is/image/Target/GUEST_7297f261-dae3-43f6-9cb2-39018f7ae4c8 ', ' https://target.scene7.com/is/image/Target/GUEST_2c94bbba-816b-4bed-867d-d21aa6b3721f ', ' https://target.scene7.com/is/image/Target/GUEST_de375bac-e84d-4c0b-8d6a-8284ab7992a2 ', ' https://target.scene7.com/is/image/Target/GUEST_65241b5a-d917-4ca7-90fc-fe06000562ac ', ' https://target.scene7.com/is/image/Target/GUEST_de375bac-e84d-4c0b-8d6a-8284ab7992a2']",a0de6f77-38c4-5691-8739-eb69951369df,2022-06-12
5,Busch Non-Alcoholic Beer - 12pk/12 fl oz Cans,Busch,https://target.scene7.com/is/image/Target/GUEST_2f13521b-4525-4ec8-aefe-33907df0f75e,47136114,"Busch Non Alcoholic Beer lets you enjoy traditional rich Busch flavor without the alcohol. This beer features a smooth, full bodied, malty flavor. It is fully brewed with a blend of American hops, fine barley malt, cereal grains, and pure water. 12 pack.",9.99,"Wine, Beer & Liquor","['https://target.scene7.com/is/image/Target/GUEST_2f13521b-4525-4ec8-aefe-33907df0f75e ', ' https://target.scene7.com/is/image/Target/GUEST_91b74149-884e-4666-a81e-753d557f91f0 ', ' https://target.scene7.com/is/image/Target/GUEST_5072c2e9-0318-4eec-8823-cf9fc13f292a ', ' https://target.scene7.com/is/image/Target/GUEST_b27c7e2c-7d3f-4445-8407-02360b6fe94b ', ' https://target.scene7.com/is/image/Target/GUEST_e8d63e21-128f-47df-b820-79752ca664ec']",9bac3aba-e6f5-5878-a3e2-8e02a7fca270,2022-06-12
6,Natural Light Beer - 12pk/12 fl oz Cans,Natural Light,https://target.scene7.com/is/image/Target/GUEST_b66f1c18-9b1e-477b-9436-4b2233e4b410,13392449,"Natural Light delivers a satisfyingly refreshing beer for a satisfying value. It is a well blended and balanced American-style light lager. A longer brewing process produces a lighter body, fewer calories, and an easy-drinking character. 15 pack.",9.99,"Wine, Beer & Liquor","['https://target.scene7.com/is/image/Target/GUEST_b66f1c18-9b1e-477b-9436-4b2233e4b410 ', ' https://target.scene7.com/is/image/Target/GUEST_48677602-b920-45a9-860f-01c026eb4a1b ', ' https://target.scene7.com/is/image/Target/GUEST_85138839-7e68-4174-b830-6a3b0799c031']",6ceda153-3f88-5435-a8af-535d8a6b9d21,2022-06-12
7,Country Crock Calcium Vegetable Oil Spread Tub - 15oz,Country Crock,https://target.scene7.com/is/image/Target/GUEST_200ad2d7-68e1-4562-bece-bc219e359e89,13376150,"Bring authentic, country-fresh flavor to the table with Country Crock® Calcium Buttery Spread Tub - 15 oz. This buttery spread gives you the rich, creamy, and delicious flavor you love, along with 8% daily value of calcium per 1 tbsp serving. Slow-churned in Kansas and carefully crafted with farm-grown ingredients, you can always count on Country Crock to be free of any artificial flavors and preservatives. There's a reason Country Crock has been a trusted favorite at the center of family tables for generations! 

Ready to use right out of the fridge, Country Crock Calcium Buttery Spread can be spread on top of your favorite breads and pastries for a deliciously decadent buttery treat. Use it as a secret ingredient to add depth of flavor and richness to your cooking and baking favorites from appetizers to main dishes, desserts, and more. Country Crock Calcium is free of gluten, hydrogenated oils, dairy, and lactose, has 0g cholesterol and trans fat per 1 tbsp serving, and has 75% less saturated fat than a 1 tbsp serving of traditional dairy butter. 

Brought to you by Country Crock, a brand committed to welcoming everyone to the table. We treat everyone like family and every place like home. Our products are sustainably farmed and responsibly sourced. When you can spread, top, cook and bake just about anything with this buttery spread, the options are endless with Country Crock!",3.19,Dairy,"['https://target.scene7.com/is/image/Target/GUEST_200ad2d7-68e1-4562-bece-bc219e359e89 ', ' https://target.scene7.com/is/image/Target/GUEST_751cc1ca-e9c3-4f09-b990-f13591195e88 ', ' https://target.scene7.com/is/image/Target/GUEST_43adb582-94c9-4b6a-8338-5371fb4ec17e ', ' https://target.scene7.com/is/image/Target/GUEST_73aab09c-4c67-4bcc-a540-f74c7aec1fd8 ', ' https://target.scene7.com/is/image/Target/GUEST_0a8d9901-8fb9-4cde-b960-48f18abf096f ', ' https://target.scene7.com/is/image/Target/GUEST_43adb582-94c9-4b6a-8338-5371fb4ec17e']",613fc5f3-a377-57f9-997c-1f4e64e9a89a,2022-06-12
8,MadeGood Organic Gluten Free Chocolate Chip Cookies Soft Baked - 12ct Traypack,MadeGood,https://target.scene7.com/is/image/Target/GUEST_b55f5cd7-df55-426e-89c3-00b869a1880c,85871556,"When we set out to bake cookies we wanted them to be like homemade: soft, moist and tender. MadeGood® Soft Baked Cookies are everything you crave. They are just the right size, low in sugar, gluten-free, packed with a serving of vegetables, high in vitamin A, C, D, E and B6 so you can always treat yourself! With flavors that wow, these are cookies made with love! <br />",7.99,Snacks,"['https://target.scene7.com/is/image/Target/GUEST_b55f5cd7-df55-426e-89c3-00b869a1880c ', ' https://target.scene7.com/is/image/Target/GUEST_a21f3e08-97ad-4be1-a830-fbe32299c9cc ', ' https://target.scene7.com/is/image/Target/GUEST_9539c328-f489-42be-b94a-c31f13bde4fe']",aa2eea63-378a-5574-9899-8940f69ca520,2022-06-12
11,Lion Coffee Lion Gold Medium Roast Ground Coffee - 10oz,LION Coffee,https://target.scene7.com/is/image/Target/GUEST_41282053-add3-4bc7-a40c-46670c171932,47101064,"LION Gold Coffee is a classic medium-light roast coffee that makes a great breakfast coffee. This means that there is some real caffeine kick in this bag to get your day started! This LION Coffee brew is bright in the cup with a mellow taste and sweet, delicate, and slightly citrus finish.",7.39,Beverages,"['https://target.scene7.com/is/image/Target/GUEST_41282053-add3-4bc7-a40c-46670c171932 ', ' https://target.scene7.com/is/image/Target/GUEST_ac2e0661-0842-4f4f-b8d4-cfb922ba05ed ', ' https://target.scene7.com/is/image/Target/GUEST_d4891a77-535e-4143-9284-e80d4b22d1f7']",9af41a12-cd87-5f2f-b175-ff11d51b5f89,2022-06-12
12,Kendall-Jackson Avant Unoaked Chardonnay White Wine - 750ml Bottle,Kendall-Jackson,https://target.scene7.com/is/image/Target/GUEST_22ed0cf9-d3f5-43da-84cb-ba13775255dd,14767807,"Kendall-Jackson Avant Unoaked Chardonnay White Wine is primarily sourced from California's Monterey County, Santa Barbara County and Mendocino County. This Kendall-Jackson Chardonnay wine combines crisp green apple, citrus and tropical fruit notes for the perfect dry white wine that is a superb accompaniment for food. It also has flavors and aromas of pineapple, juicy pear and wildflowers.

This youthful and lively white wine Chardonnay is handcrafted to be expressive, fruit forward and vibrant. It is 100% stainless steel fermented with a Stelvin screw cap closure helps to preserve the aromatic freshness and youthfulness of the wine. Pair this white wine Chardonnay with sushi, halibut, fried calamari and fish tacos for an excellent meal.

Kendall-Jackson is committed to producing only the finest quality wines from Chardonnay grape varietals grown in California. One aspect that distinguishes a Kendall-Jackson wine is vineyard sourcing. The majority of fruit sourced for Kendall-Jackson wines is grown on the 12,000 acres of estate vineyards owned by the Jackson family. All of the estate vineyards are certified sustainable by the CCSW (Certified California Sustainable Winegrowing) and SIP (Sustainability in Practice) programs. The proprietary approach to winemaking has earned Kendall-Jackson a world-renowned reputation for white wines that consistently exhibit signature rich layers of flavor, combined with a delicate balance.

This bottled wine has a 13.5% ABV.",13.99,"Wine, Beer & Liquor","['https://target.scene7.com/is/image/Target/GUEST_22ed0cf9-d3f5-43da-84cb-ba13775255dd ', ' https://target.scene7.com/is/image/Target/GUEST_06fa9dc9-d2fa-4afe-90e2-7d99fa0f459c ', ' https://target.scene7.com/is/image/Target/GUEST_1d5f8b78-c3f3-4f7f-9155-114a1b30eba5 ', ' https://target.scene7.com/is/image/Target/GUEST_eecab4f3-4fab-4951-b10b-e370e25bd71e ', ' https://target.scene7.com/is/image/Target/GUEST_16dea9e8-f247-418c-948a-c9af64fc4f4e ', ' https://target.scene7.com/is/image/Target/GUEST_1d5f8b78-c3f3-4f7f-9155-114a1b30eba5']",b5df4bb4-1f3c-51cc-bf9b-29b7d0240acc,2022-06-12
13,Royal Kona 100% Kona Medium Roast Whole Bean Coffee - 7oz,Royal Kona,https://target.scene7.com/is/image/Target/GUEST_14d5715e-3216-41d5-84f7-648dde78077a,47101090,"Natural Kona coffee is extremely rare and makes our 100% Kona coffee exceptionally special. The intricate process to harvest and mill the coffee beans gives our premium Kona coffee the delicious taste and silky mouthfeel you know and love. As with all Royal Kona Coffees, this blend is gluten-free and does not contain nut allergens. Supply of natural Kona coffee is extremely limited, so try this while you can!",19.69,Beverages,"['https://target.scene7.com/is/image/Target/GUEST_14d5715e-3216-41d5-84f7-648dde78077a ', ' https://target.scene7.com/is/image/Target/GUEST_f337c75f-c50f-4779-a44d-efc8f4b8c0ea ', ' https://target.scene7.com/is/image/Target/GUEST_3064bafe-e85f-49c0-ab79-af1b6e8378ba']",d521c3f0-fae1-5dec-b5a4-8e24c9b9d251,2022-06-12
14,Oroweat Sourdough English Muffins - 13oz,Oroweat,https://target.scene7.com/is/image/Target/GUEST_0c4e7b50-f3ef-42a4-8d35-a6ec6f97f9e3,47092807,"Oroweat sour dough english muffins are soft, tangy, and delicious when toasted. Top with butter or your favorite spread, and savor that old world sourdough flavor.",3.39,Bakery & Bread,"['https://target.scene7.com/is/image/Target/GUEST_0c4e7b50-f3ef-42a4-8d35-a6ec6f97f9e3 ', ' https://target.scene7.com/is/image/Target/GUEST_c350211f-bb6b-4bc5-85ac-3fbfbf6113e5 ', ' https://target.scene7.com/is/image/Target/GUEST_d73fb427-ca9d-4823-a4c2-ecccd5f3eb93 ', ' https://target.scene7.com/is/image/Target/GUEST_9f02e79f-b0a7-4056-ab26-a8d71940b254']",67aa02fe-1dbf-5b7d-9ba3-71aa407b7a78,2022-06-12
15,Kashi Go Peanut Butter Crunch Cereal - 13.2oz,Kashi,https://target.scene7.com/is/image/Target/GUEST_326f2c2e-a4ae-4c5a-a4b7-ced13674bdd5,52993997,"Treat yourself to the delicious taste of multigrain clusters bursting with peanut buttery goodness in every bite of Kashi GO Peanut Butter Crunch breakfast cereal. Includes 1, 13.2-ounce box of breakfast cereal. Whether it’s starting the morning with a quick and easy breakfast or enjoying as a midday snack, Kashi GO breakfast cereal delivers big peanut butter flavor that’s sure to please. Both vegan and Non-GMO Project Verified, each wholesome serving provides 10g of protein and 6g of fiber; Kashi GO breakfast cereal is the perfect way to power your day. Enjoy with your favorite milk or pair with fruit or yogurt for a delicious breakfast. For a portable snack, pack reusable baggies of Kashi GO Peanut Butter Crunch into your purse, lunch box or gym bag. Kashi GO Peanut Butter Crunch cereal also makes a great after dinner treat by the handful or as a topping on your favorite ice cream. Anytime is the right time for Kashi GO Peanut Butter Crunch cereal. Kashi is making planet-positive choices to lower our company’s impact on climate change. We measure the amount of emissions from the manufacturing plants that create our foods and invest in renewable energy projects and programs in the US that remove the same amount of emissions from the air.",3.99,Breakfast & Cereal,"['https://target.scene7.com/is/image/Target/GUEST_326f2c2e-a4ae-4c5a-a4b7-ced13674bdd5 ', ' https://target.scene7.com/is/image/Target/GUEST_6961e233-0959-4a65-971a-4338f2aca7d4 ', ' https://target.scene7.com/is/image/Target/GUEST_07a15de3-9c8f-40c9-9cea-d746a71e01f1 ', ' https://target.scene7.com/is/image/Target/GUEST_31b45b2f-a12b-4dbc-934c-3c35240b2fbd ', ' https://target.scene7.com/is/image/Target/GUEST_6d29ba97-dc75-489c-972c-6f5e97c67a3b ', ' https://target.scene7.com/is/image/Target/GUEST_07a15de3-9c8f-40c9-9cea-d746a71e01f1']",e421c31f-6557-5a82-b941-9f6f96fa622f,2022-06-12
16,Cholula Chili Garlic Hot Sauce - 5oz,Cholula,https://target.scene7.com/is/image/Target/GUEST_5efa4c75-4e9d-4ad0-bbb5-d11bc6704130,12992100,"Calling all garlic fans, this Cholula Chili Garlic Hot Sauce is a must try. The robust goodness of garlic comes alive when paired with Cholula's arbol and piquin peppers and signature spices. It's a natural fit on pasta, soups and believe it or not - popcorn. Uncap Real Flavor with Cholula Chili Garlic. Imported from Mexico. Made in Mexico.",3.39,Pantry,"['https://target.scene7.com/is/image/Target/GUEST_5efa4c75-4e9d-4ad0-bbb5-d11bc6704130 ', ' https://target.scene7.com/is/image/Target/GUEST_f6f51415-45c0-4beb-931f-cf2abdf9206f ', ' https://target.scene7.com/is/image/Target/GUEST_bd271fea-f62a-4612-9b3b-a6f063eb11f0 ', ' https://target.scene7.com/is/image/Target/GUEST_490e2cf2-06aa-4254-a387-37d4d1b8b03a ', ' https://target.scene7.com/is/image/Target/GUEST_e08c6998-8fbb-449f-94b4-301736bb3f18 ', ' https://target.scene7.com/is/image/Target/GUEST_bd271fea-f62a-4612-9b3b-a6f063eb11f0']",83e0929f-141c-5766-bffe-7f3af2503f78,2022-06-12
17,Yellow Tail Chardonnay White Wine - 1.5L Bottle,yellow tail,https://target.scene7.com/is/image/Target/GUEST_025e12b8-711c-44bc-828a-1d8e6463ae75,13463194,"Made in South Eastern Australia, [ yellow tail ] Chardonnay is a white wine that brings the flavors and essence of the region to your glass, ensuring a smile with each sip. This chardonnay is everything a great wine should be with its easy to drink, rich taste and vibrant flavor profile. Featuring fresh flavors of peach and melon with a hint of vanilla, this white wine is full bodied and silky smooth. Enjoy this white wine with roast chicken or salad greens. Take an adventurous approach to this bottle of wine by adding chardonnay wine to a cinnamon pear cocktail, perfect for sharing with friends. [ yellow tail ] wine is wonderful for livening up casual dinners with loved ones and bringing a lighthearted spirit to any and every event and celebration. This [ yellow tail ] wine bottle is 1.5 L and has a 13% ABV. Great quality wine can be affordable and good fun too. We like our wines to be vibrant, flavorsome and approachable, making everyday moments even more enjoyable. A wine for any occasion, [ yellow tail ] is easy to choose, drink and enjoy.",11.99,"Wine, Beer & Liquor","['https://target.scene7.com/is/image/Target/GUEST_025e12b8-711c-44bc-828a-1d8e6463ae75 ', ' https://target.scene7.com/is/image/Target/GUEST_8c809c8f-193d-4cee-aaf6-0f505c8af539 ', ' https://target.scene7.com/is/image/Target/GUEST_395439d3-a8fc-481e-a37f-ede149ab6e4e ', ' https://target.scene7.com/is/image/Target/GUEST_02cc0f4d-771e-4e74-8966-94e4dd952bb8 ', ' https://target.scene7.com/is/image/Target/GUEST_395439d3-a8fc-481e-a37f-ede149ab6e4e']",3871117a-9ef6-5ae8-8aee-9f59adde310d,2022-06-12
18,Bogle Vineyards Phantom Red Blend Wine - 750ml Bottle,Bogle Vineyards,https://target.scene7.com/is/image/Target/GUEST_0f5e7f06-c862-4680-b133-596f2509d33d,47134208,"Intriguing, beguiling... This mysterious apparition of ripe berry and relentless spice returns to haunt wine lovers. Enveloped in shadow, this wine's intensity and concentration will entice you with every sip. Full-bodied and jammy, Phantom's origins of Petite Sirah and Zinfandel emerge from the glass. Spicy pepper and juniper tantalize your senses, while black plums and blueberries emerge on the palate. Notes of pipe tobacco and clove settle around the finish, long and lingering, like Delta fog.",15.99,"Wine, Beer & Liquor","['https://target.scene7.com/is/image/Target/GUEST_0f5e7f06-c862-4680-b133-596f2509d33d ', ' https://target.scene7.com/is/image/Target/GUEST_7da04d65-ecb5-44eb-b4eb-26b520e917c6 ', ' https://target.scene7.com/is/image/Target/GUEST_0d895196-3b03-4d5d-83af-57860e381040 ', ' https://target.scene7.com/is/image/Target/GUEST_fe7681d7-8891-44c3-a35c-f30e76c98057 ', ' https://target.scene7.com/is/image/Target/GUEST_2e7a43ff-1bf6-4349-a472-1236b989a1f1 ', ' https://target.scene7.com/is/image/Target/GUEST_0d895196-3b03-4d5d-83af-57860e381040']",0f35b8d2-3485-5119-bc0f-c2d7c5642a43,2022-06-12
19,Alkaline Water - 1.5L Bottle - Good & Gather™,Good & Gather,https://target.scene7.com/is/image/Target/GUEST_310d542b-f9ad-4d35-8940-6845c5ea13f8,54511777,"Alkaline Water from Good & Gather™ is a great way to stay hydrated and refreshed no matter what your day has in store. This bottle of  purified water with electrolytes for taste will keep you feeling refreshed and hydrated, and it has a pH 9.5+ balance, making it the perfect choice for rehydrating after a demanding workout, a vigorous game of flag football or just a day spent out in the sun. Throw a bottle in your backpack or keep one in your gym bag to stay refreshed and hydrated before, during and after your workout, or keep a couple bottles on hand for thirst-quenching goodness no matter what's on your schedule. <br /><br />Every product that carries the Good & Gather™ name starts with quality ingredients that deliver great taste, making it easier for you and your family to eat well, every day. We promise you'll love each bite, or your money back.",1.69,Beverages,"['https://target.scene7.com/is/image/Target/GUEST_310d542b-f9ad-4d35-8940-6845c5ea13f8 ', ' https://target.scene7.com/is/image/Target/GUEST_7b4c63bf-a77a-49be-8eef-4ff3fa50a385 ', ' https://target.scene7.com/is/image/Target/GUEST_6ce70fed-9361-434e-acbf-6864e030d50a ', ' https://target.scene7.com/is/image/Target/GUEST_6ce70fed-9361-434e-acbf-6864e030d50a']",4e0bda65-4e92-5033-9f62-320165d38ef7,2022-06-12
20,Bud Light & Clamato Beer - 4pk/16 fl oz Cans,Bud Light,https://target.scene7.com/is/image/Target/GUEST_89c28d6f-c432-472d-a243-5b495396a83a,47135921,"Bud Light Chelada Light Beer combines the refreshing taste of Bud Light with the richness of a Clamato tomato cocktail. It follows the traditional brewing process for Bud Light, then Clamato is carefully blended with the beer to create the proper balance of the crisp finish of Bud Light and the signature taste of Clamato. Bud Light Chelada has a 4.2% ABV. Enjoy Bud Light Chelada beer anytime the occasion calls for refreshing drinks. To best enjoy, gently rotate the chilled can once before pouring. Then pour over ice into a traditional goblet-style glass and garnish with a slice of lime. The spicy beer pairs perfectly with many dishes, and is great for backyard gatherings with friends, family and food. Grab a pack of the convenient beer cans anytime you're looking for alcohol drinks.",6.99,"Wine, Beer & Liquor","['https://target.scene7.com/is/image/Target/GUEST_89c28d6f-c432-472d-a243-5b495396a83a ', ' https://target.scene7.com/is/image/Target/GUEST_e8147a40-ff95-4b86-9a8b-0ae52365bb55 ', ' https://target.scene7.com/is/image/Target/GUEST_0ceff277-73e3-4b0a-9b60-fbf3e4d3dc9a']",bfc3a92d-76dc-5448-89ba-9ce0eb84d8c0,2022-06-12
21,Budweiser Lager Beer - 6pk/16 fl oz Cans,Budweiser,https://target.scene7.com/is/image/Target/GUEST_3fa718ca-ae8c-4a92-a29c-b78da7c41516,47136126,"Budweiser beer is a medium-bodied, American-style lager beer. Brewed with high quality barley malt, a blend of premium hop varieties, fresh rice and filtered water, this American beer is crisp and full of flavor. Budweiser beer has a 5% ABV. 6 pack.",6.99,"Wine, Beer & Liquor","['https://target.scene7.com/is/image/Target/GUEST_3fa718ca-ae8c-4a92-a29c-b78da7c41516 ', ' https://target.scene7.com/is/image/Target/GUEST_5e0470be-e43e-4f95-a62f-450b65310ed7 ', ' https://target.scene7.com/is/image/Target/GUEST_6e456f25-8af2-419f-9c23-24c76c5ebf05 ', ' https://target.scene7.com/is/image/Target/GUEST_5831d3ec-6fc1-45eb-b482-c3dbcf9849e8']",ea8e0273-afe0-5056-92d8-ba52f93253fa,2022-06-12
